title,group,subgroup,author,format,publisher,pub_date,isbn,blurb,image_url
The Housemaid,Fiction,,Freida McFadden,Paperback,Grand Central Publishing,"August 23, 2022",978-1538742570,"An addictive psychological thriller with a jaw-dropping twist. Perfect for fans of Ruth Ware, Lisa Jewell, and <em>Verity</em>.",https://m.media-amazon.com/images/I/81AHTyq2wVL._SY342_.jpg
Theo of Golden,Fiction,,Allen Levi,Paperback,Allen Levi,"October 11, 2023",979-8988702900,"<em>Theo of Golden</em> is a beautifully crafted story about the power of creative generosity, the importance of wonder to a purposeful life, and the far-reaching possibilities of anonymous kindness.",https://m.media-amazon.com/images/I/519lCZIOotL._SL1500_.jpg
The Correspondent,Fiction,,Virginia Evans,Hardcover,Crown,"April 29, 2025",978-0593798430,Discover the word-of-mouth hit hailed by Ann Patchett as “A cause for celebration”—an intimate novel about the transformative power of the written word and the beauty of slowing down to reconnect with the people we love.,https://m.media-amazon.com/images/I/813k-BbIZ+L._SL1500_.jpg
The Housemaid's Secret,Fiction,,Freida McFadden,Paperback,Poisoned Pen Press,1-Oct-24,978-1728296227,"This absolutely explosive and shockingly twisty sequel to international phenomenon and <em>New York Times</em>, <em>USA Today</em>, and <em>Wall Street Journal</em> bestseller <em>The Housemaid</em> will keep you racing through the pages late into the night. Anyone who loves <em>The Perfect Marriage</em> by Jeneva Rose, <em>The Woman in the Window</em>, and <em>Gone Girl</em> will be totally hooked!",https://m.media-amazon.com/images/I/71waptWklgL._SL1500_.jpg
The Last Letter,Fiction,, Rebecca Yarros,Paperback,Entangled: Amara,"February 26, 2019",978-1640635333,"If you’re reading this, well, you know the last-letter drill. You made it. I didn’t. Get off the guilt train, because I know if there was any chance you could have saved me, you would have.",https://m.media-amazon.com/images/I/81mrHyhbtTL._SL1500_.jpg
The Housemaid's Wedding: A Short Story,Fiction,,Freida McFadden,Paperback,Independently Published,"November 4, 2024",979-8344920047,"I'm engaged to the man of my dreams, and in a few short hours, I'm going to stand before a judge, who will declare us husband and wife, till death does us part. There's only one problem: Someone out there doesn't want me to live long enough to say my vows.",https://m.media-amazon.com/images/I/71AQWDUx1bL._SL1500_.jpg
The Housemaid Is Watching,Fiction,,Freida McFadden,Paperback,Poisoned Pen Press,"June 11, 2024",978-1464221132,"From <em>New York Times</em>, <em>USA Today</em> and <em>Wall Street Journal</em> bestselling author Freida McFadden comes the next installment of the unbelievably twisty, tension-packed and globally bestselling <em>Housemaid</em> series. This book can be enjoyed as a standalone read: and once you start, it will have you up all night racing through the pages until the final explosive twist. ",https://m.media-amazon.com/images/I/91OSM58Y-pL._SL1500_.jpg
Project Hail Mary,Fiction,,Andy Weir,Paperback,Ballantine Books,"October 4, 2022",978-0593135228,"An irresistible interstellar adventure as only Andy Weir could deliver, <em>Project Hail Mary is a tale of discovery, speculation, and survival to rival <em>The Martian</em>—while taking us to places it never dreamed of going.",https://m.media-amazon.com/images/I/81gYjHx8YmL._SL1500_.jpg
The Frozen River: A GMA Book Club Pick: A Novel,Fiction,,Ariel Lawhon,Paperback,Vintage Books,"November 5, 2024",978-0593312070,"Clever, layered, and subversive, Ariel Lawhon’s newest offering introduces an unsung heroine who refused to accept anything less than justice at a time when women were considered best seen and not heard.",https://m.media-amazon.com/images/I/91ulu+khYLL._SL1500_.jpg
The Widow: A Novel,Fiction,,John Grisham,Hardcover,Doubleday,"October 21, 2025",978-0385548984,"Once he hooks the richest client of his career, Simon works quietly to keep her wealth under the radar. But soon her story begins to crack. When she is hospitalized after a car accident, Simon realizes that nothing is as it seems, and he finds himself on trial for a crime he swears he didn’t commit: murder.",https://m.media-amazon.com/images/I/81CWXchKvRL._SL1500_.jpg
Sunrise on the Reaping (A Hunger Games Novel),Young Adult,,Suzanne Collins,Hardcover,Scholastic Press,"March 18, 2025",978-1546171461,"The phenomenal fifth book in the <em>Hunger Games</em> series! When you’ve been set up to lose everything you love, what is there left to fight for?",https://m.media-amazon.com/images/I/61o5Q8IIq4L._SL1500_.jpg
Throne of Glass,Young Adult,,Sarah J. Maas,Paperback,Bloomsbury Publishing,"February 14, 2023",978-1639730957,"Enter the world of Throne of Glass with the first book in this complete, #1 bestselling series by Sarah J. Maas, author of the Court of Thorns and Roses (ACOTAR) series.",https://m.media-amazon.com/images/I/919YkFdlilL._SL1500_.jpg
The Giver,Young Adult,,Lois Lowry,Paperback,Clarion Books,"July 1, 1993",978-0544336261,"Life in the community where Jonas lives is idyllic. Designated birthmothers produce newchildren, who are assigned to appropriate family units. Citizens are assigned their partners and their jobs. No one thinks to ask questions. Everyone obeys. Everyone is the same. Except Jonas.",https://m.media-amazon.com/images/I/81Yq5WKWfSL._SL1500_.jpg
Lord of the Flies,Young Adult,,William Golding,Paperback,Penguin Books,"December 16, 2003",978-0399501487,"At the dawn of the next world war, a plane crashes on an uncharted island, stranding a group of schoolboys. At first, with no adult supervision, their freedom is something to celebrate. This far from civilization they can do anything they want. Anything. But as order collapses, as strange howls echo in the night, as terror begins its reign, the hope of adventure seems as far removed from reality as the hope of being rescued.",https://m.media-amazon.com/images/I/716MU3GOvJL._SL1200_.jpg
That's Not My Name,Young Adult,,Megan Lally,Paperback,Sourcebooks Fire,"December 26, 2023",978-1728270111,She thought she had her life back. She was wrong. A gripping debut thriller perfect for fans of Natalie D. Richards and Vincent Ralph.,https://m.media-amazon.com/images/I/810aGh1VYZL._SL1500_.jpg
For the Fans! (KPop Demon Hunters): Official Storybook,Children's,,Angela Song,Hardcover,Golden Books,"December 30, 2025",979-8217233977,"This Little Golden Book, based on Netflix's hit animated film <em>KPop Demon Hunters</em>, is sure to delight demon hunters of all ages!",https://m.media-amazon.com/images/I/815EomP+9nL._SL1500_.jpg
Talons of Power: A Graphic Novel,Children's,,Tui T. Sutherland,Paperback,Graphix,"December 30, 2025",978-1339001265,"The #1 <em>New York Times</em> bestselling Wings of Fire series soars to new heights in the ninth graphic novel adaptation, with art by Mike Holmes.",https://m.media-amazon.com/images/I/81Jy4unrBFL._SL1500_.jpg
The Amazing Generation: Your Guide to Fun and Freedom in a Screen-Filled World,Children's,,Jonathan Haidt and Catherine Price,Paperback,Rocky Pond Books,"December 30, 2025",979-8217111916,"Inspired by the #1 <em>New York Times</em> bestseller <em>The Anxious Generation</em>, this new book for kids and tweens is a comprehensive guide for living a happy and exciting life that isn’t hijacked by a smartphone.",https://m.media-amazon.com/images/I/81okE1yHWHL._SL1500_.jpg
I Love you to the Moon and Back,Children's,,Amelia Hepworth and Tim Warnes,Hardcover,Tiger Tales,"September 17, 2024",978-1664300545,"Show your child just how strong your love is every minute of the day with this sweet, gentle rhyme that's perfect for sharing. Now in a jacketed hardcover format!",https://m.media-amazon.com/images/I/81y8aCy-20L._SL1500_.jpg
The Very Hungry Caterpillar,Children's,,Eric Carle,Hardcover,World of Eric Carle,"March 23, 1994",978-0399226908,"Follow along as one of nature’s loveliest marvels eats his way through an amazing variety of foods as he prepares to grow into a beautiful butterfly! Children will love the strikingly bold, colorful pictures against a simple text in large, clear type.",https://m.media-amazon.com/images/I/81qsstEtrgL._SL1500_.jpg
Forgotten Home Apothecary : 250 Powerful Remedies at Your Fingertips,Nonfiction,Lifestyle,Dr. Nicole Apelian,Paperback,Global Brother,"October 8, 2024",979-8988024095,"This is the only holistic medicine book out there where you’ll find the time-tested natural remedies our grandparents relied on, back when apothecaries hadn’t yet been replaced by pharmacies.",https://m.media-amazon.com/images/I/81+efMYN9wL._SL1500_.jpg
The Bible in 52 Weeks: A Yearlong Bible Study for Women,Nonfiction,Lifestyle,Dr. Kimberly D. Moore,Paperback,Callisto,"February 11, 2020",978-1641528153,Strengthen your faith week by week with this yearlong journey through the Bible for women―Now a <em>USA Today</em> bestseller!,https://m.media-amazon.com/images/I/81uMXwLcakL._SL1500_.jpg
The Bible Recap: A One-Year Guide to Reading and Understanding the Entire Bible,Nonfiction,Lifestyle,Tara-Leigh Cobble,Hardcover,Bethany House Publishers,"November 3, 2020",978-0764237034,"If you've ever wanted to read through the Bible or even just wanted to want to read it, <em>The Bible Recap</em> is here to help. Following a chronological Bible reading plan, these recaps explain and connect the Old Testament and New Testament, section by section.",https://m.media-amazon.com/images/I/71CaU+HWrXL._SL1500_.jpg
Murdle: Volume 1,Nonfiction,Lifestyle,G. T. Karber,Paperback,Griffin,"June 13, 2023",978-1250892317,"G. T. Karber, the creator of the popular online daily mystery game Murdle, presents the first collection of 100 original murder mystery logic puzzles―a perfect gift for armchair detectives and puzzlers to hone their minds and solve a series of crimes.",https://m.media-amazon.com/images/I/7198Z7YiOPL._SL1500_.jpg
Outlive: The Science and Art of Longevity,Nonfiction,Lifestyle,"Peter Attia, MD and Bill Gifford",Hardcover,Harmony,"March 28, 2023",978-0593236598,"Aging and longevity are far more malleable than we think; our fate is not set in stone. With the right roadmap, you can plot a different path for your life, one that lets you outlive your genes to make each decade better than the one before.",https://m.media-amazon.com/images/I/71X9FMy66NL._SL1500_.jpg
The Let Them Theory: A Life-Changing Tool That Millions of People Can't Stop Talking About,Nonfiction,Self-Help & Advice,Mel Robbins and Sawyer Robbins,Hardcover,Hay House LLC,"December 24, 2024",978-1401971366,"Two simple words—Let Them—will set you free. Free from the opinions, drama, and judgments of others. Free from the exhausting cycle of trying to manage everything and everyone around you. <em>The Let Them Theory </em>puts the power to create a life you love back in your hands—and this book will show you exactly how to do it.",https://m.media-amazon.com/images/I/91ZVf3kNrcL._SL1500_.jpg
Atomic Habits,Nonfiction,Self-Help & Advice,James Clear,Hardcover,Avery,"October 16, 2018",978-0735211292,"No matter your goals, <em>Atomic Habits</em> offers a proven framework for improving—every day. James Clear, one of the world’s leading experts on habit formation, reveals practical strategies that will teach you exactly how to form good habits, break bad ones, and master the tiny behaviors that lead to remarkable results.",https://m.media-amazon.com/images/I/81ANaVZk5LL._SL1500_.jpg
Don't Believe Everything You Think,Nonfiction,Self-Help & Advice,Joseph Nguyen,Hardcover,Authors Equity,"October 29, 2024",979-8893310153,"In this book, you’ll discover the root cause of all psychological and emotional suffering and how to achieve freedom of mind to effortlessly create the life you’ve always wanted to live.",https://m.media-amazon.com/images/I/819I+YyuU-L._SL1500_.jpg
"The Body Keeps the Score: Brain, Mind, and Body in the Healing of Trauma",Nonfiction,Self-Help & Advice,Bessel van der Kolk M.D.,Paperback,Penguin Books,"September 8, 2015",978-0143127741,"In <em>The Body Keeps the Score</em>, Dr. van der Kolk uses recent scientific advances to show how trauma literally reshapes both body and brain, compromising sufferers’ capacities for pleasure, engagement, self-control, and trust.",https://m.media-amazon.com/images/I/71Ha3OShqSL._SL1500_.jpg
The Four Agreements: A Practical Guide to Personal Freedom,Nonfiction,Self-Help & Advice,Don Miguel Ruiz,Paperback,Tarcher,"November 7, 1997",978-1878424310,"Based on ancient Toltec wisdom, <em>The Four Agreements</em> offer a powerful code of conduct that can rapidly transform our lives to a new experience of freedom, true happiness, and love.",https://m.media-amazon.com/images/I/913A1+rl-gL._SL1500_.jpg
The Miracles Among Us: How God's Grace Plays a Role in Healing,Nonfiction,Biography & Autobiography,Dr. Marc Siegel,Hardcover,Harper Influence,"November 18, 2025",978-0063426283,"From Fox News Senior Medical Analyst and Clinical Professor of Medicine at NYU Langone Health, Dr. Marc Siegel, comes a collection of powerful, true-life stories of healing, faith, and surprise, complete with a beautiful prayer guide inside.",https://m.media-amazon.com/images/I/71FpanHsQ-L._SL1500_.jpg
"That's a Great Question, I'd Love to Tell You",Nonfiction,Biography & Autobiography,Elyse Myers,Hardcover,William Morrow,"October 28, 2025",978-0063381308,"Writer, comedian, and content creator Elyse Myers gets real about life’s awkward moments in her bold, funny, and unfiltered debut book.",https://m.media-amazon.com/images/I/81aQHlBJFNL._SL1500_.jpg
"Tuesdays with Morrie: An Old Man, a Young Man, and Life's Greatest Lesson, 25th Anniversary Edition",Nonfiction,Biography & Autobiography,Mitch Albom,Paperback,Crown,"October 8, 2002",978-0767905923,"A special 25th anniversary edition of the beloved book that has changed millions of lives with the story of an unforgettable friendship, the timeless wisdom of older generations, and healing lessons on loss and grief—featuring a new afterword by the author.",https://m.media-amazon.com/images/I/91JGbl7K1OL._SL1500_.jpg
"Family of Spies: A World War II Story of Nazi Espionage, Betrayal, and the Secret History Behind Pearl Harbor",Nonfiction,Biography & Autobiography,Christine Kuehn,Hardcover,Celadon Books,"November 25, 2025",978-1250344465,"It began with a letter from a screenwriter, asking about a story. <em>Your family. World War II. Nazi spies.</em> Christine Kuehn was shocked and confused. When she asked her seventy-year-old father, Eberhard, what this could possibly be about, he stalled, deflected, demurred, and then wept. He knew this day would come.",https://m.media-amazon.com/images/I/81r2r1we+BL._SL1500_.jpg
When Breath Becomes Air,Nonfiction,Biography & Autobiography,Paul Kalanithi,Hardcover,Random House,"January 12, 2016",978-0812988406,"At the age of thirty-six, on the verge of completing a decade’s worth of training as a neurosurgeon, Paul Kalanithi was diagnosed with stage IV lung cancer. One day he was a doctor treating the dying, and the next he was a patient struggling to live.",https://m.media-amazon.com/images/I/61gwba1pQnL._SL1500_.jpg
"The Psychology of Money: Timeless lessons on wealth, greed, and happiness","Left, Right, and Center",,Morgan Housel,Paperback,Harriman House,"September 8, 2020",978-0857197689,"In <em>The Psychology of Money</em>, award-winning author Morgan Housel shares 19 short stories exploring the different ways people think about money and teaches you how to make better sense of one of life's most important topics.",https://m.media-amazon.com/images/I/81wZXiu4OiL._SL1500_.jpg
"Stop, in the Name of God: Why Honoring the Sabbath Will Transform Your Life","Left, Right, and Center",,Charlie Kirk,Hardcover,Winning Team Publishing,"December 9, 2025",979-8218777920,"Through <em>Stop in the Name of God</em>, bestselling author Charlie Kirk guides you on how to unplug, recharge, and reconnect with God, family, and yourself in a way that nurtures your soul. In a world dominated by screens and constant noise, Kirk presents the Sabbath as a radical act of resistance.",https://m.media-amazon.com/images/I/71pGYKl2rvL._SL1500_.jpg
1929: Inside the Greatest Crash in Wall Street History—and How It Shattered a Nation,"Left, Right, and Center",,Andrew Ross Sorkin,Hardcover,Viking,"October 14, 2025",978-0593296967,"More than just a history, <em>1929</em> is a crucial blueprint for understanding the cycles of speculation, the forces that drive financial upheaval, and the warning signs we ignore at our peril.",https://m.media-amazon.com/images/I/71C12i+HeHL._SL1500_.jpg
Nobody's Girl: A Memoir of Surviving Abuse and Fighting for Justice,"Left, Right, and Center",,Virginia Roberts Giuffre,Hardcover,Knopf,"October 21, 2025",978-0593493120,"<em>Nobody’s Girl</em> is an astonishing affirmation of the late Virginia Roberts Giuffre’s unshakable will—first, to claw her way out of victimhood, and then to shine light on wrongdoing and fight for a safer, fairer world. Equal parts intimate and fierce, it is a remarkable narrative of fortitude in the face of depravity and despair.",https://m.media-amazon.com/images/I/61KzpshHPZL._SL1500_.jpg
The 48 Laws of Power,"Left, Right, and Center",,Robert Greene,Paperback,Penguin Books,"September 1, 2000",978-0140280197,"Some laws teach the need for prudence (""Law 1: Never Outshine the Master""), others teach the value of confidence (""Law 28: Enter Action with Boldness""), and many recommend absolute self-preservation (""Law 15: Crush Your Enemy Totally""). Every law, though, has one thing in common: an interest in total domination. In a bold and arresting two-color backage, <em>The 48 Laws of Power</em> is ideal whether your aim is conquest, self-defense, or simply to understand the rules of the game.",https://m.media-amazon.com/images/I/611X8GI7hpL._SL1500_.jpg
How to Test Negative for Stupid: And Why Washington Never Will,"Left, Right, and Center",,John Kennedy,Hardcover,Broadside Books,"October 7, 2025",978-0063428164,"One of the most distinctive and funny politicians, Senator John Kennedy (the one from Louisiana) offers his perceptive (and hilarious) takes on the ridiculousness of political life in this scathingly witty takedown of Washington and its elite denizens.",https://m.media-amazon.com/images/I/71tbImx2YVL._SL1500_.jpg
"The Only Living Trusts Book You’ll Ever Need: How to Make Your Own Living Trust, Avoid Probate & Protect Your Heirs","Left, Right, and Center",,Garrett Monroe,Paperback,Independently Published,"June 25, 2024",979-8324197421,"Don’t leave the future of your estate up to chance. This is your toolkit to ensure your assets are managed exactly as you wish, without the interference of courts or the burden of unnecessary taxes.",https://m.media-amazon.com/images/I/611re5rEukL._SL1499_.jpg
Rich Dad Poor Dad: What the Rich Teach Their Kids About Money That the Poor and Middle Class Do Not!,"Left, Right, and Center",,Robert T. Kiyosaki ,Paperback,Plata Publishing,"April 5, 2022",978-1612681139,"<em>Rich Dad Poor Dad</em> is Robert's story of growing up with two dads—his real father and the father of his best friend, his rich dad—and the ways in which both men shaped his thoughts about money and investing. The book explodes the myth that you need to earn a high income to be rich and explains the difference between working for money and having your money work for you.",https://m.media-amazon.com/images/I/81BE7eeKzAL._SL1500_.jpg
Meditations,"Left, Right, and Center",,"Marcus Aurelius, translation by James Harris",Paperback,Independently Published,"November 7, 2016",978-1539952299,"<em>Meditations</em> is a series of personal writings by Marcus Aurelius, Roman Emperor from 161 to 180 AD, recording his private notes to himself and ideas on Stoic philosophy.",https://m.media-amazon.com/images/I/71wSz6VVk6L._SL1500_.jpg
Black AF History: The Un-Whitewashed Story of America,"Left, Right, and Center",,Michael Harriot,Hardcover,Dey Street Books,"September 19, 2023",978-0358439165,"From acclaimed columnist and political commentator Michael Harriot, a searingly smart and bitingly hilarious retelling of American history that corrects the record and showcases the perspectives and experiences of Black Americans.",https://m.media-amazon.com/images/I/81cAGCCob7L._SL1500_.jpg
"The Young Person's Guide to Health and Wellness: Keep Fit, Think Smart, Get the Most from Your Life",Recommended Books,,Ahron Friedberg MD,Paperback,Skyhorse,"January 13, 2026",978-1510784567,"<p><strong><em>A practical guide setting young people on a path to greater wellbeing</em></strong><em><br /> <br /> The Young Person’s Guide to Health and Wellness </em>grew out of Dr. Friedberg’s hands-on role in creating a holistic health, wellness, and athletic program at the Portledge School in Locust Valley, N.Y. Under his continued guidance, the program helps students pursue the best version of themselves in every dimension of their lives. It enables them to develop strong habits that will anchor them as they grow towards maturity.</p><p><em>The Young Person’s Guide to Health and Wellness</em> elaborates on these habits, demonstrating how young people can apply them in their own lives. “What is ‘good’ nutrition for someone with my body type and energy expenditure?” “How do I build community in my neighborhood?” The <em>Guide </em>is designed so that young people can approach the tenets through reading and reflection, augmented by discussion in classrooms or team meetings. Each chapter, explaining a particular tenet, will include questions for reflection and discussion. Ultimately, the <em>Guide</em> encourages young people not to leave health and wellness to luck or chance, but to take responsibility for their psychological and physical wellbeing. By developing an awareness of health and wellness, and making it the basis of sound habits, young people can better prepare for whatever comes next.</p>",https://m.media-amazon.com/images/I/71hM1G6-wsL._SL1500_.jpg
Theodore Roosevelt's Brotherhood of America: A Daily Journal of the President’s Nationwide Travels,Recommended Books,,James Blase,Hardcover,Independently published,"October 29, 2025",979-8271721137,"<p>This recently released, coffee table size book traces President Roosevelt’s train trips across the continental United States by constructing a first-person journal account of the President’s tour of the entire country, from the spring of 1902 through the fall of 1905—five months of Theodore Roosevelt's presidency, in total. <em><u>Read the first two chapters for free at facebook.com/jamesblase.author/</u></em></p><p>50 years in the making, the author has included a prelude to each chapter of the President's journey, highlighting the message of brotherhood the President preached in each particular geographical area of the country.</p><p>To add to the reader's enjoyment, the author has included over 250 photographs and turn-of-the-century railroad maps from virtually every day of the President's travels.</p>",https://m.media-amazon.com/images/I/61ssiiPgrtL._SL1329_.jpg
Anatomy of an Alibi: A Novel,Recommended Books,,Ashley Elston,Hardcover,Pamela Dorman Books,"January 13, 2026",978-0593834459,"<p><strong>Two women. One dead husband. And only one alibi.</strong><br /> <br /> Everyone at Chantilly’s Bar noticed out-of-towner Camille Bayliss. Red lips, designer heels, sipping a Negroni. But that woman wasn’t Camille Bayliss. It was Aubrey Price.</p><p>Camille Bayliss appears to have the picture-perfect life; she’s married to hotshot lawyer Ben and is the daughter of a wealthy Louisiana family. Only nothing is as it seems: Camille believes Ben has been hiding dirty secrets for years, but she can’t find proof because he tracks her every move.</p><p>Aubrey Price has been haunted by the terrible night that changed her life a decade ago, and she’s convinced Benjamin Bayliss knows something about it. Living in a house full of criminals, Aubrey understands there’s more than one way to get to the truth—and she may have found the best way in.</p><p>Aubrey and Camille hatch a plan. It sounds simple: For twelve hours, Aubrey will take Camille’s place. Camille will spy on Ben, and the two women will get the answers they desperately seek.</p><p>Except the next morning, Ben is found murdered. Both women need an airtight alibi, but only one of them has it. And one false step is all it takes for everything to come undone.</p>",https://m.media-amazon.com/images/I/81xA2938-FL._SL1500_.jpg
