title,group,subgroup,author,format,publisher,pub_date,isbn,blurb,image_url
The Secret of Secrets: A Novel,Fiction,,Dan Brown,Hardcover,Doubleday,"September 9, 2025",978-0385546898,"The world’s most celebrated thriller writer and author of <em>The Da Vinci Code</em> returns with his most stunning novel yet—a propulsive, twisty, thought-provoking masterpiece that will entertain readers as only Dan Brown can do.",https://m.media-amazon.com/images/I/71KSpVjctXL._SL1500_.jpg
Wild Card (Deluxe Edition),Fiction,,Elsie Silver,Paperback,Bloom Books,"September 9, 2025",978-1464220845,"Gwen sees the heat in his eyes. That look of need that never fails to send a shiver down her spine. The mutual longing is borderline unbearable, and the simmering heat between them is downright palpable. They both know there are rules when it comes to situations like this. But then again…following the rules has never felt so futile.",https://blackwells.co.uk/jacket/500x500/9780349441696.webp
Fahrenheit 451,Fiction,,Ray Bradbury,Paperback,Simon & Schuster,"January 10, 2012",978-1451673319,"Nearly seventy years after its original publication, Ray Bradbury’s internationally acclaimed novel <em>Fahrenheit 451</em> stands as a classic of world literature set in a bleak, dystopian future. Today its message has grown more relevant than ever before.",https://m.media-amazon.com/images/I/61sKsbPb5GL._SL1500_.jpg
The Color of Death: A Novel,Fiction,,Trey Gowdy and Christopher Greyson,Hardcover,Harper Influence,"August 26, 2025",978-0063451919,"Taking readers inside the cat-and-mouse psychology of a killer and the assistant district attorney who must catch him, this thrilling fiction debut from bestselling author Trey Gowdy and celebrated author Christopher Greyson will keep you guessing until the very last page.",https://m.media-amazon.com/images/I/81aPAbk3FmL._SL1500_.jpg
The Frozen River: A GMA Book Club Pick: A Novel,Fiction,,Ariel Lawhon,Paperback,Vintage Books,"November 5, 2024",978-0593312070,"Clever, layered, and subversive, Ariel Lawhon’s newest offering introduces an unsung heroine who refused to accept anything less than justice at a time when women were considered best seen and not heard.",https://m.media-amazon.com/images/I/91ulu+khYLL._SL1500_.jpg
Project Hail Mary,Fiction,,Andy Weir,Paperback,Ballantine Books,"October 4, 2022",978-0593135228,"An irresistible interstellar adventure as only Andy Weir could deliver, <em>Project Hail Mary is a tale of discovery, speculation, and survival to rival <em>The Martian</em>—while taking us to places it never dreamed of going.",https://m.media-amazon.com/images/I/81gYjHx8YmL._SL1500_.jpg
Theo of Golden,Fiction,,Allen Levi,Paperback,Allen Levi,"October 11, 2023",979-8988702900,"<em>Theo of Golden</em> is a beautifully crafted story about the power of creative generosity, the importance of wonder to a purposeful life, and the far-reaching possibilities of anonymous kindness.",https://m.media-amazon.com/images/I/519lCZIOotL._SL1500_.jpg
The Housemaid,Fiction,,Freida McFadden,Paperback,Grand Central Publishing,23-Aug-22,978-1538742570,"An addictive psychological thriller with a jaw-dropping twist. Perfect for fans of Ruth Ware, Lisa Jewell, and <em>Verity</em>.",https://m.media-amazon.com/images/I/81AHTyq2wVL._SY342_.jpg
The Nightingale: A Novel,Fiction,,Kristin Hannah,Paperback,St. Martin's Griffin,"April 25, 2017",978-1250080400,"A heartbreakingly beautiful novel that celebrates the resilience of the human spirit and the durability of women. It is a novel for everyone, a novel for a lifetime.",https://m.media-amazon.com/images/I/81OkWjcf4WL._SY342_.jpg
My Friends: A Novel,Fiction,,Fredrik Backman,Hardcover,Atria Books,"May 6, 2025",978-1982112820,"Most people don’t even notice them—three tiny figures sitting at the end of a long pier in the corner of one of the most famous paintings in the world. Most people think it’s just a depiction of the sea. But Louisa, an aspiring artist herself, knows otherwise, and she is determined to find out the story of these three enigmatic figures.",https://m.media-amazon.com/images/I/71BJfwwzjhL._SL1500_.jpg
The Outsiders,Young Adult,,S. E. Hinton,Paperback,Viking Books for Young Readers,"April 20, 2006",978-0142407332,<em>The Outsiders</em> is a dramatic and enduring work of fiction that laid the groundwork for the YA genre. S. E. Hinton’s classic story of a boy who finds himself on the outskirts of regular society remains as powerful today as it was the day it was first published.,https://m.media-amazon.com/images/I/71Bg39CmhoL._SL1500_.jpg
Lord of the Flies,Young Adult,,William Golding,Paperback,Penguin Books,"December 16, 2003",978-0399501487,"At the dawn of the next world war, a plane crashes on an uncharted island, stranding a group of schoolboys. At first, with no adult supervision, their freedom is something to celebrate. This far from civilization they can do anything they want. Anything. But as order collapses, as strange howls echo in the night, as terror begins its reign, the hope of adventure seems as far removed from reality as the hope of being rescued.",https://m.media-amazon.com/images/I/716MU3GOvJL._SL1200_.jpg
The Summer I Turned Pretty,Young Adult,,Jenny Han,Paperback,Simon & Schuster Books for Young Readers,"April 6, 2010",978-1416968290,"Belly measures her life in summers. Everything good, everything magical happens between the months of June and August. Winters are simply a time to count the weeks until the next summer. But one summer, one wonderful and terrible summer, the more everything changes, the more it all ends up just the way it should have been all along.",https://m.media-amazon.com/images/I/71j25Ib5FSL._SL1500_.jpg
Holes,Young Adult,,Louis Sachar,Paperback,Yearling,"May 9, 2000",978-0440414803,"Stanley Yelnats is under a curse. A curse that began with his no-good-dirty-rotten-pig-stealing-great-great-grandfather and has since followed generations of Yelnatses. Now Stanley has been unjustly sent to a boys' detention center, Camp Green Lake, where the boys build character by spending all day, every day digging holes exactly five feet wide and five feet deep. There is no lake at Camp Green Lake. But there are an awful lot of holes.",https://m.media-amazon.com/images/I/81wiZw1LEXL._SL1500_.jpg
The Giver,Young Adult,,Lois Lowry,Paperback,Clarion Books,1-Jul-93,978-0544336261,"Life in the community where Jonas lives is idyllic. Designated birthmothers produce newchildren, who are assigned to appropriate family units. Citizens are assigned their partners and their jobs. No one thinks to ask questions. Everyone obeys. Everyone is the same. Except Jonas.",https://m.media-amazon.com/images/I/81Yq5WKWfSL._SL1500_.jpg
"My First Learn-to-Write Workbook: Practice for Kids with Pen Control, Line Tracing, Letters, and More!",Children's,,Crystal Radke,Paperback,Callisto Kids,"August 27, 2019",978-1641526272,Help your little one build communication skills with the ultimate writing workbook for kids ages 3 to 5. More than 2 million copies sold!,https://m.media-amazon.com/images/I/71c+ReofeoL._SL1500_.jpg
Just Shine!: How to Be a Better You,Children's,,Sonia Sotomayor,Hardcover,Philomel Books,"September 9, 2025",978-0593206294,"With art by award-winning illustrator Jacqueline Alcántara, <em>Just Shine</em> will help readers find their own inner glow—and recognize that glow in those around them.",https://m.media-amazon.com/images/I/81kMSeocOqL._SL1500_.jpg
The Very Hungry Caterpillar,Children's,,Eric Carle,Hardcover,World of Eric Carle,"March 23, 1994",978-0399226908,"Follow along as one of nature’s loveliest marvels eats his way through an amazing variety of foods as he prepares to grow into a beautiful butterfly! Children will love the strikingly bold, colorful pictures against a simple text in large, clear type.",https://m.media-amazon.com/images/I/81qsstEtrgL._SL1500_.jpg
"See You Later, Alligator",Children's,,Sally Hopgood,Hardcover,Sky Pony,"September 20, 2016",978-1510704848,"A departing tortoise has his bags packed and is almost ready to set out on an adventure, but he can’t leave until he says good-bye to each of his animal friends. The tortoise stops for every last timid mouse and bumblebee, shouting his rhyming good-byes, making you wonder if, perhaps, he’s stalling the start of his trip.",https://m.media-amazon.com/images/I/71Aj3RpT9rL._SL1400_.jpg
I Love you to the Moon and Back,Children's,,Amelia Hepworth and Tim Warnes,Hardcover,Tiger Tales,17-Sep-24,978-1664300545,"Show your child just how strong your love is every minute of the day with this sweet, gentle rhyme that's perfect for sharing. Now in a jacketed hardcover format!",https://m.media-amazon.com/images/I/81y8aCy-20L._SL1500_.jpg
Nobody Wants Your Sh*t: The Art of Decluttering Before You Die,Nonfiction,Lifestyle,Messie Condo,Hardcover,Skyhorse,7-Mar-23,978-1510774735,"Whether you’re getting ready to move in, move on, or just move your ass, <em>Nobody Wants Your Sh*t</em> will help you take control of your f*cking life.",https://m.media-amazon.com/images/I/71Lkoauu7+L._SL1500_.jpg
Forgotten Home Apothecary : 250 Powerful Remedies at Your Fingertips,Nonfiction,Lifestyle,Dr. Nicole Apelian,Paperback,Global Brother,"October 8, 2024",979-8988024095,"This is the only holistic medicine book out there where you’ll find the time-tested natural remedies our grandparents relied on, back when apothecaries hadn’t yet been replaced by pharmacies.",https://m.media-amazon.com/images/I/81+efMYN9wL._SL1500_.jpg
It Doesn't Have to Hurt: Your Smart Guide to a Pain-Free Life,Nonfiction,Lifestyle,Sanjay Gupta MD,Hardcover,Simon & Schuster,"September 2, 2025",978-1668014479,Transform your everyday life by reducing and eliminating chronic pain with the latest science-backed pain relief techniques and expert practical advice from America’s bestselling doctor and neurosurgeon Sanjay Gupta.,https://m.media-amazon.com/images/I/811bgzwdtlL._SL1500_.jpg
Sally's Baking 101: Foolproof Recipes from Easy to Advanced,Nonfiction,Lifestyle,Sally McKenney,Hardcover,Clarkson Potter,"September 2, 2025",978-0593581964,"The ultimate baking book for home cooks of all skill levels with 101 sweet and savory, foolproof recipes plus helpful tips for best results—from the creator of the beloved website Sally’s Baking Addiction.",https://m.media-amazon.com/images/I/817vSFskw3L._SL1500_.jpg
What to Expect When You're Expecting: (Updated in 2024),Nonfiction,Lifestyle,Heidi Murkoff ,Paperback,Workman Publishing Company,"May 31, 2016",978-0761187486,"Your pregnancy explained and your pregnant body demystified, head (what to do about those headaches) to feet (why they’re so swollen), back (how to stop it from aching) to front (why you can’t tell a baby by mom’s bump). Filled with must-have information, practical advice, realistic insight, easy-to-use tips, and lots of reassurance, you’ll also find the very latest on prenatal screenings, which medications are safe, and the most current birthing options—from water birth to gentle c-sections.",https://m.media-amazon.com/images/I/91SvhlQthSL._SL1500_.jpg
The Let Them Theory: A Life-Changing Tool That Millions of People Can't Stop Talking About,Nonfiction,Self-Help & Advice,Mel Robbins and Sawyer Robbins,Hardcover,Hay House LLC,"December 24, 2024",978-1401971366,"Two simple words—Let Them—will set you free. Free from the opinions, drama, and judgments of others. Free from the exhausting cycle of trying to manage everything and everyone around you. <em>The Let Them Theory </em>puts the power to create a life you love back in your hands—and this book will show you exactly how to do it.",https://m.media-amazon.com/images/I/91ZVf3kNrcL._SL1500_.jpg
Atomic Habits,Nonfiction,Self-Help & Advice,James Clear,Hardcover,Avery,"October 16, 2018",978-0735211292,"No matter your goals, <em>Atomic Habits</em> offers a proven framework for improving—every day. James Clear, one of the world’s leading experts on habit formation, reveals practical strategies that will teach you exactly how to form good habits, break bad ones, and master the tiny behaviors that lead to remarkable results.",https://m.media-amazon.com/images/I/81ANaVZk5LL._SL1500_.jpg
"The Body Keeps the Score: Brain, Mind, and Body in the Healing of Trauma",Nonfiction,Self-Help & Advice,Bessel van der Kolk MD,Paperback,Penguin Books,"September 8, 2015",978-0143127741,"In <em>The Body Keeps the Score</em>, Dr. van der Kolk uses recent scientific advances to show how trauma literally reshapes both body and brain, compromising sufferers’ capacities for pleasure, engagement, self-control, and trust.",https://m.media-amazon.com/images/I/71Ha3OShqSL._SL1500_.jpg
The Anxious Generation: How the Great Rewiring of Childhood Is Causing an Epidemic of Mental Illness,Nonfiction,Self-Help & Advice,Jonathan Haidt,Hardcover,Penguin Press,"March 26, 2024",978-0593655030,"A must-read for all parents: the generation-defining investigation into the collapse of youth mental health in the era of smartphones, social media, and big tech—and a plan for a healthier, freer childhood.",https://m.media-amazon.com/images/I/81Rz9l29NiL._SL1500_.jpg
Don't Believe Everything You Think,Nonfiction,Self-Help & Advice,Joseph Nguyen,Hardcover,Authors Equity,"October 29, 2024",979-8893310153,"In this book, you’ll discover the root cause of all psychological and emotional suffering and how to achieve freedom of mind to effortlessly create the life you’ve always wanted to live.",https://m.media-amazon.com/images/I/819I+YyuU-L._SL1500_.jpg
The Book of Sheen: A Memoir,Nonfiction,Biography & Autobiography,Charlie Sheen,Hardcover,Gallery Books,"September 9, 2025",978-1668075289,"For the first time, Charlie Sheen, the star of <em>Platoon</em>, <em>Wall Street</em>, <em>Major League</em>, and <em>Two and a Half Men</em>, writes the story of his extraordinary life in an unfiltered memoir.",https://m.media-amazon.com/images/I/71t1zLjp8uL._SL1500_.jpg
"All the Way to the River: Love, Loss, and Liberation",Nonfiction,Biography & Autobiography,Elizabeth Gilbert,Hardcover,Riverhead Books,9-Sep-25,978-0593540985,"<em>All the Way to the River</em> is a landmark memoir that will resonate with anyone who has ever been captive to love—or to any other passion, substance, or craving—and who yearns, at long last, for liberation.",https://m.media-amazon.com/images/I/81Bo+NGrsWL._SL1500_.jpg
Into the Magic Shop: A Neurosurgeon's Quest to Discover the Mysteries of the Brain and the Secrets ofthe Heart,Nonfiction,Biography & Autobiography,James R. Doty MD,Paperback,Avery,"February 14, 2017",978-0399183645,"Part memoir, part science, part inspiration, and part practical instruction, <em>Into the Magic Shop</em> shows us how we can fundamentally change our lives by first changing our brains and our hearts.",https://m.media-amazon.com/images/I/81cXxSbzz6L._SL1500_.jpg
"Sister Wife: A Memoir of Faith, Family, and Finding Freedom",Nonfiction,Biography & Autobiography,Christine Brown Woolley,Hardcover,Gallery Books,"September 2, 2025",978-1668078266,"In this candid tell-all, Christine shares for the first time the journey that led her away from polygamy and the bold path she is carving to live apart from all she has ever known. Moving, genuine, and insightful, this is a uniquely powerful tour de force of Christine’s journey toward and beyond her time in the spotlight as a sister wife.",https://m.media-amazon.com/images/I/71pjC4YIfOL._SL1500_.jpg
"Chasing Evil: Shocking Crimes, Supernatural Forces, and an FBI Agent’s Search for Hope and Justice",Nonfiction,Biography & Autobiography,John Edward and Robert Hilland,Hardcover,St. Martin's Essentials,"September 2, 2025",978-1250291752,"Centering on the investigation of the gruesome John Smith murders that rocked the nation, <em>Chasing Evil</em> is a heart-stopping story of murder, justice, and finding help in unexpected places.",https://m.media-amazon.com/images/I/81We0dk7PuL._SL1500_.jpg
The Constitution of the United States and The Declaration of Independence,"Left, Right, and Center",,Delegates of The Constitutional Convention,Paperback,Racehorse,"October 11, 2016",978-1631581489,"Whether you are a Democrat, Republican, or independent, whether you are a supporter of Donald Trump or not, if you live and vote in the United States of America, you understand that The Constitution of the United States and The Declaration of Independence are two of the most important documents in American history.",https://m.media-amazon.com/images/I/81HGOLMQ+UL._SL1500_.jpg
Listening to the Law: Reflections on the Court and Constitution,"Left, Right, and Center",,Amy Coney Barrett,Hardcover,Sentinel,"September 9, 2025",978-0593421864,"From Supreme Court Justice Amy Coney Barrett, a glimpse of her journey to the Court and an account of her approach to the Constitution.",https://m.media-amazon.com/images/I/61uxXO50IFL._SL1500_.jpg
Confronting Evil: Assessing the Worst of the Worst,"Left, Right, and Center",,Bill O'Reilly and Josh Hammer,Hardcover,St. Martin's Press,"September 9, 2025",978-1250374042,"The concept of evil is universal, ancient, and ever present today. The biblical book of Genesis clearly defines it when Cain kills his brother Abel out of jealousy. Evil is a choice to make another suffer. As long as human beings have walked, evil has been close by. In <em>Confronting Evil</em>, Bill O'Reilly and Josh Hammer recount the deeds of the worst people in history.",https://m.media-amazon.com/images/I/81wHKIbiJSL._SL1500_.jpg
"The Psychology of Money: Timeless lessons on wealth, greed, and happiness","Left, Right, and Center",,Morgan Housel,Paperback,Harriman House,"September 8, 2020",978-0857197689,"In <em>The Psychology of Money</em>, award-winning author Morgan Housel shares 19 short stories exploring the different ways people think about money and teaches you how to make better sense of one of life's most important topics.",https://m.media-amazon.com/images/I/81wZXiu4OiL._SL1500_.jpg
Black AF History: The Un-Whitewashed Story of America,"Left, Right, and Center",,Michael Harriot,Hardcover,Dey Street Books,"September 19, 2023",978-0358439165,"From acclaimed columnist and political commentator Michael Harriot, a searingly smart and bitingly hilarious retelling of American history that corrects the record and showcases the perspectives and experiences of Black Americans.",https://m.media-amazon.com/images/I/81cAGCCob7L._SL1500_.jpg
"Vaccines, Amen: The Religion of Vaccines","Left, Right, and Center",,Aaron Siri,Paperback,Injecting Freedom LLC,"September 4, 2025",979-8992423006,"Ever hear “I believe in cars” or “I believe in tools”? Probably not. But people routinely say, “I believe in vaccines.” This saying carries a truism because claims about vaccines often require faith. Belief. It is why challenging these claims often results in an emotional, not logical, reaction.",https://m.media-amazon.com/images/I/719Nn6r5TgL._SL1499_.jpg
Think and Grow Rich,"Left, Right, and Center",,"By Napoleon Hill, Foreword by Steve Harvey",Hardcover,Skyhorse,"March 8, 2016",978-1510734739,"The single greatest guide to achieving success ever written, featuring a new foreword by Steve Harvey!",https://m.media-amazon.com/images/I/61tvx3+FG0L._SL1500_.jpg
The 48 Laws of Power,"Left, Right, and Center",,Robert Greene,Paperback,Penguin Books,"September 1, 2000",978-0140280197,"Some laws teach the need for prudence (""Law 1: Never Outshine the Master""), others teach the value of confidence (""Law 28: Enter Action with Boldness""), and many recommend absolute self-preservation (""Law 15: Crush Your Enemy Totally""). Every law, though, has one thing in common: an interest in total domination. In a bold and arresting two-color backage, <em>The 48 Laws of Power</em> is ideal whether your aim is conquest, self-defense, or simply to understand the rules of the game.",https://m.media-amazon.com/images/I/611X8GI7hpL._SL1500_.jpg
Lions and Scavengers: The True Story of America (and Her Critics),"Left, Right, and Center",,Ben Shapiro,Hardcover,Threshold Editions,"September 2, 2025",978-1668097885,"In <em>Lions and Scavengers</em>, Shapiro invites you to take up the mantle of the Lion and defend the principles that shape the freedom of a fair, powerful society. With the stakes higher than ever, this book is a gripping exploration of the ongoing war between those who cherish our nation and those who seek to undermine it.",https://m.media-amazon.com/images/I/71k7GJZBYjL._SL1500_.jpg
Unreasonable Hospitality: The Remarkable Power of Giving People More Than They Expect,"Left, Right, and Center",,Will Guidara,Hardcover,Optimism Press,"October 25, 2022",978-0593418574,"Today, every business can choose to be a hospitality business—and we can all transform ordinary transactions into extraordinary experiences. Featuring sparkling stories of his journey through restaurants, with the industry’s most famous players, Guidara urges us all to find the magic in what we do.",https://m.media-amazon.com/images/I/71KOER-LUQL._SL1500_.jpg
"Zenith Man: Death, Love, and Redemption in a Georgia Courtroom",Recommended Books,,McCracken Poston Jr.,Hardcover,Citadel,"February 20, 2024",978-0806542799,"<p><strong>An inspiring argument for compassion in the pursuit of true justice for readers of <em>Midnight in the Garden of Good and Evil </em>and<em> Just Mercy.</em></strong><br /> <br /> <em>Was this small-town TV repair man “a harmless eccentric or a bizarre killer” (Atlanta Journal Constitution). For the first time, Alvin Ridley’s own defense attorney reveals the inside story of his case and trial in an extraordinary tale of friendship and an idealistic young attorney’s quest to clear his client’s name—and, in the process, rebuild his own life.</em></p> <p>In October 1997, the town of Ringgold in northwest Georgia was shaken by reports of a murder in its midst. A dead woman was found in Alvin Ridley’s house—and even more shockingly, she was the wife no one knew he had.</p> <p>McCracken Poston had been a state representative before he lost his bid for U.S. Congress and returned to his law career. Alvin Ridley was a local character who once sold and serviced Zenith televisions. Though reclusive and an outsider, the “Zenith Man,” as Poston knew him, hardly seemed capable of murder.</p>",https://m.media-amazon.com/images/I/81joF93OasL._SL1500_.jpg
"Separation of Church and Hate: A Sane Person's Guide to Taking Back the Bible from Fundamentalists, Fascists, and Flock-Fleecing Frauds",Recommended Books,,John Fugelsang,Hardcover,Avid Reader Press / Simon & Schuster,"September 9, 2025",978-1668066898,"<p><strong>In the spirit of George Carlin and Christopher Hitchens, the son of a former Catholic nun and a Franciscan brother delivers a deeply irreverent and biblically correct takedown of far-right Christian hatred—a book for believers, atheists, agnostics, and anyone who’ll ever have to deal with a Christian nationalist.</strong><br /> <br /> For more than two centuries, the United States Constitution has given us the right to a society where church and state exist independently. But Christianity has been hijacked by far-right groups and politicians who seek to impose their narrow views on government, often to justify oppressive and unequal policies. The extremists who weaponize the Bible for earthly power aren’t actually on the side of Jesus—and historically they never have been. How do we fight back against those acting—literally—in bad faith?</p> <p>Comedian and broadcaster John Fugelsang finally offers the answers. In this informative, perspective-shifting book, Fugelsang takes readers through common fundamentalist arguments on abortion, immigration, LGBTQ rights, and more—exposing their hypocrisy and inaccuracy through scripture, common sense, and deeply inappropriate humor. It offers practical tips on how to debate your loved one, coworker, or neighbor on the issues that divide us using that Bible they claim to follow.</p>",https://m.media-amazon.com/images/I/71HVHru7HrL._SL1500_.jpg
Alchemised,Recommended Books,,SenLinYu,Hardcover,Del Rey,"September 23, 2025",978-0593972700,"<p><strong>In this riveting dark fantasy debut, a woman with missing memories fights to survive a war-torn world of necromancy and alchemy—and the man tasked with unearthing the deepest secrets of her past.</strong><br /> <br /> “<em>What is it you think you’re protecting in that brain of yours? The war is over. Holdfast is dead. The Eternal Flame extinguished. There’s no one left for you to save.”</em></p> <p>Once a promising alchemist, Helena Marino is now a prisoner—of war and of her own mind. Her Resistance friends and allies have been brutally murdered, her abilities suppressed, and the world she knew destroyed.</p> <p>In the aftermath of a long war, Paladia’s new ruling class of corrupt guild families and depraved necromancers, whose vile undead creatures helped bring about their victory, holds Helena captive.</p> <p>According to Resistance records, she was a healer of little importance within their ranks. But Helena has inexplicable memory loss of the months leading up to her capture, making her enemies wonder: Is she truly as insignificant as she appears, or are her lost memories hiding some vital piece of the Resistance’s final gambit?</p>",https://m.media-amazon.com/images/I/91G2hnAVQgL._SL1500_.jpg
